{
  "year": 2015,
  "source": {
    "provaPdf": "p15.pdf",
    "gabaritoPdf": "g15.pdf"
  },
  "generatedAt": "2025-12-26T00:01:58.073724",
  "questions": [
    {
      "number": 1,
      "stem": "Examine estas imagens produzidas no antigo Egito: Reino Antigo (2575-2134 a.C.) Reino Novo (1550-1070 a.C.) Reino Novo (1550-1070 a.C.) Apud Ciro Flammarion Santana Cardoso. O Egito antigo. São Paulo: Brasiliense, 1982. As imagens revelam",
      "options": [
        {
          "key": "A",
          "text": "o caráter familiar do cultivo agrícola no Oriente Próximo, dada a escassez de mão de obra e a proibição, no antigo Egito, do trabalho compulsório."
        },
        {
          "key": "B",
          "text": "a inexistência de qualquer conhecimento tecnológico que permitisse o aprimoramento da produção de alimentos, o que provocava longas temporadas de fome."
        },
        {
          "key": "C",
          "text": "o prevalecimento da agricultura como única atividade econômica, dada a impossibilidade de caça ou pesca nas regiões ocupadas pelo antigo Egito."
        },
        {
          "key": "D",
          "text": "a dificuldade de acesso à água em todo o Egito, o que limitava as atividades de plantio e inviabilizava a criação de gado de maior porte."
        },
        {
          "key": "E",
          "text": "a importância das atividades agrícolas no antigo Egito, que ocupavam os trabalhadores durante aproximadamente metade do ano."
        }
      ],
      "bbox": {
        "x": 77,
        "y": 48,
        "w": 805,
        "h": 459
      },
      "page": 1,
      "answer": {
        "correct": "E"
      },
      "id": "fuvest-2015-q01",
      "year": 2015,
      "explanation": {
        "theory": "Pendente",
        "steps": [],
        "distractors": {
          "A": "",
          "B": "",
          "C": "",
          "D": "",
          "E": ""
        },
        "finalSummary": ""
      },
      "assets": {
        "questionImage": "/assets/questions/2015/q01/image.png"
      }
    },
    {
      "number": 2,
      "stem": "Em certos aspectos, os gregos da Antiguidade foram sempre um povo disperso. Penetraram em pequenos grupos no mundo mediterrânico e, mesmo quando se instalaram e acabaram por dominá-lo, permaneceram desunidos na sua organização política. No tempo de Heródoto, e muito antes dele, encontravam-se colônias gregas não somente em toda a extensão da Grécia atual, como também no litoral do Mar Negro, nas costas da atual Turquia, na Itália do sul e na Sicília oriental, na costa setentrional da África e no litoral mediterrânico da França. No interior desta elipse de uns 2500 km de comprimento, encontravam-se centenas e centenas de comunidades que amiúde diferiam na sua estrutura política e que afirmaram sempre a sua soberania. Nem então nem em nenhuma outra altura, no mundo antigo, houve uma nação, um território nacional único regido por uma lei soberana, que se tenha chamado Grécia (ou um sinônimo de Grécia). M. I. Finley. O mundo de Ulisses. Lisboa: Editorial Presença, 1972. Adaptado. Com base no texto, pode-se apontar corretamente",
      "options": [
        {
          "key": "A",
          "text": "a desorganização política da Grécia antiga, que sucumbiu rapidamente ante as investidas militares de povos mais unidos e mais bem preparados para a guerra, como os egípcios e macedônios."
        },
        {
          "key": "B",
          "text": "a necessidade de profunda centralização política, como a ocorrida entre os romanos e cartagineses, para que um povo pudesse expandir seu território e difundir sua produção cultural."
        },
        {
          "key": "C",
          "text": "a carência, entre quase todos os povos da Antiguidade, de pensadores políticos, capazes de formular estratégias adequadas de estruturação e unificação do poder político."
        },
        {
          "key": "D",
          "text": "a inadequação do uso de conceitos modernos, como nação ou Estado nacional, no estudo sobre a Grécia antiga, que vivia sob outras formas de organização social e política."
        },
        {
          "key": "E",
          "text": "a valorização, na Grécia antiga, dos princípios do patriotismo e do nacionalismo, como forma de consolidar política e economicamente o Estado nacional."
        }
      ],
      "bbox": {
        "x": 77,
        "y": 557,
        "w": 805,
        "h": 353
      },
      "page": 1,
      "answer": {
        "correct": "D"
      },
      "id": "fuvest-2015-q02",
      "year": 2015,
      "explanation": {
        "theory": "Pendente",
        "steps": [],
        "distractors": {
          "A": "",
          "B": "",
          "C": "",
          "D": "",
          "E": ""
        },
        "finalSummary": ""
      },
      "assets": {
        "questionImage": "/assets/questions/2015/q02/image.png"
      }
    },
    {
      "number": 3,
      "stem": "A cidade é [desde o ano 1000] o principal lugar das trocas econômicas que recorrem sempre mais a um meio de troca essencial: a moeda. [...] Centro econômico, a cidade é também um centro de poder. Ao lado do e, às vezes, contra o poder tradicional do bispo e do senhor, frequentemente confundidos numa única pessoa, um grupo de homens novos, os cidadãos ou burgueses, conquista \"liberdades\", privilégios cada vez mais amplos. Jacques Le Goff. São Francisco de Assis. Rio de Janeiro: Record, 2010. Adaptado. O texto trata de um período em que",
      "options": [
        {
          "key": "A",
          "text": "os fundamentos do sistema feudal coexistiam com novas formas de organização política e econômica, que produziam alterações na hierarquia social e nas relações de poder."
        },
        {
          "key": "B",
          "text": "o excesso de metais nobres na Europa provocava abundância de moedas, que circulavam apenas pelas mãos dos grandes banqueiros e dos comerciantes internacionais."
        },
        {
          "key": "C",
          "text": "o anseio popular por liberdade e igualdade social mobilizava e unificava os trabalhadores urbanos e rurais e envolvia ativa participação de membros do baixo clero."
        },
        {
          "key": "D",
          "text": "a igreja romana, que se opunha ao acúmulo de bens materiais, enfrentava forte oposição da burguesia ascendente e dos grandes proprietários de terras."
        },
        {
          "key": "E",
          "text": "as principais características do feudalismo, sobretudo a valorização da terra, haviam sido completamente superadas e substituídas pela busca incessante do lucro e pela valorização do livre comércio."
        }
      ],
      "bbox": {
        "x": 79,
        "y": 78,
        "w": 466,
        "h": 419
      },
      "page": 2,
      "answer": {
        "correct": "A"
      },
      "id": "fuvest-2015-q03",
      "year": 2015,
      "explanation": {
        "theory": "Pendente",
        "steps": [],
        "distractors": {
          "A": "",
          "B": "",
          "C": "",
          "D": "",
          "E": ""
        },
        "finalSummary": ""
      },
      "assets": {
        "questionImage": "/assets/questions/2015/q03/image.png"
      }
    },
    {
      "number": 4,
      "stem": "Uma observação comparada dos regimes de trabalho adotados nas Américas de colonização ibérica permite afirmar corretamente que, entre os séculos XVI e XVIII,",
      "options": [
        {
          "key": "A",
          "text": "a servidão foi dominante em todo o mundo português, enquanto no espanhol, a mão de obra principal foi assalariada."
        },
        {
          "key": "B",
          "text": "a liberdade foi conseguida plenamente pelas populações indígenas da América espanhola e da América portuguesa, enquanto a dos escravos africanos jamais o foi."
        },
        {
          "key": "C",
          "text": "a escravidão de origem africana, embora presente em várias regiões da América espanhola, esteve mais generalizada na América portuguesa."
        },
        {
          "key": "D",
          "text": "não houve escravidão africana nos territórios espanhóis, pois estes dispunham de farta oferta de mão de obra indígena."
        },
        {
          "key": "E",
          "text": "o Brasil forneceu escravos africanos aos territórios espanhóis, que, em contrapartida, traficavam escravos indígenas para o Brasil."
        }
      ],
      "bbox": {
        "x": 78,
        "y": 580,
        "w": 419,
        "h": 321
      },
      "page": 2,
      "answer": {
        "correct": "C"
      },
      "id": "fuvest-2015-q04",
      "year": 2015,
      "explanation": {
        "theory": "Pendente",
        "steps": [],
        "distractors": {
          "A": "",
          "B": "",
          "C": "",
          "D": "",
          "E": ""
        },
        "finalSummary": ""
      },
      "assets": {
        "questionImage": "/assets/questions/2015/q04/image.png"
      }
    },
    {
      "number": 5,
      "stem": "Examine a seguinte imagem, que foi inspirada pela situação da Índia de 1946. (Veja a imagem da questão) Legenda: MOSLEM: muçulmano; NEW CONSTITUTION: nova Constituição; CIVIL WAR: guerra civil; FAMINE: fome. A leitura correta da imagem permite concluir que ela constitui uma crítica",
      "options": [
        {
          "key": "A",
          "text": "à passividade da ONU e dos países do chamado Terceiro Mundo diante do avanço do fundamentalismo hindu no sudeste asiático."
        },
        {
          "key": "B",
          "text": "à oficialização da religião muçulmana na Índia, diante da qual seria preferível sua manutenção como Estado cristão."
        },
        {
          "key": "C",
          "text": "ao colonialismo britânico, metaforicamente representado por animais ferozes prontos a destruir a liberdade do povo hindu."
        },
        {
          "key": "D",